{"approval_ref":"intent-20261021-001","artifact_revision":3,"checks":[{"detail":"schema rework validation, sketch names","name":"test_schema_examples","observed_at":"2026-10-21T11:00:00Z","result":"pass"}],"created_at":"2026-10-21T11:00:00Z","gaps":["watchtower schema is v0.1 draft, not ratified"],"packet_id":"packet-20261021-001","work_id":"work-7f3a"}